{
  "schemaVersion": 4,
  "createdAt": "2026-07-07T23:50:00+03:00",
  "profileName": "Surface Laptop 7 ARM64",
  "keep": {
    "edge": true,
    "gaming": false,
    "copilot": false
  },
  "source": {
    "isoPath": "tests\\fixtures\\iso\\official-win11-25h2-english-arm64-v2.iso",
    "architecture": "arm64"
  },
  "target": {
    "device": "ThisPC",
    "formFactor": "Laptop",
    "powerPlan": "Balanced",
    "editionMode": "Fixed",
    "edition": "Windows 11 Home",
    "diskMode": "AutoWipeDisk0",
    "diskLayout": {
      "preset": "",
      "roundingGb": 64,
      "windowsMinimumGb": 256,
      "windowsRecommendedGb": 384,
      "linuxMinimumGb": 128,
      "linuxRecommendedGb": 256,
      "efiMb": 1024,
      "msrMb": 16,
      "recoveryMb": 1024
    }
  },
  "identity": {
    "computerName": "WINMINT-SL7",
    "accountName": "dev",
    "accountMode": "MicrosoftOobe",
    "autoLogon": false,
    "passwordSet": false,
    "passwordIncluded": false
  },
  "regional": {
    "timeZoneId": "Israel Standard Time",
    "uiLanguage": "en-US",
    "systemLocale": "he-IL",
    "uiLanguageFallback": "en-US",
    "userLocale": "he-IL",
    "inputLocale": "en-US;he-IL",
    "homeLocationGeoId": 117,
    "secondaryInputLanguages": ["he-IL"]
  },
  "drivers": {
    "source": "SurfaceCatalog",
    "path": "surface-laptop-7",
    "exportHostDrivers": false
  },
  "desktop": {
    "cursorPack": "Windows11Modern",
    "layers": []
  },
  "development": {
    "editors": ["cursor"],
    "browsers": ["zen-browser"],
    "wsl": {
      "distros": ["FedoraLinux"]
    }
  },
  "features": {
    "launcher": "None",
    "liveInstallAudit": true,
    "phoneLink": true
  },
  "updates": {
    "mode": "None",
    "targetFeatureVersion": "25H2",
    "releaseCadence": "BRelease",
    "includeOptionalPreviews": false,
    "payloadRoot": "",
    "qualitySecurity": true,
    "dynamicUpdate": true,
    "defender": true,
    "dotnet": true,
    "provisionedApps": false
  },
  "removals": {
    "aiPolicy": "ServiceableFull"
  },
  "posture": {
    "appearance": {
      "theme": "dark"
    },
    "explorer": {
      "showFileExtensions": true,
      "showHiddenFiles": true
    },
    "accessibility": {
      "stickyKeys": "disabled"
    },
    "setup": {
      "dmaInterop": true,
      "hardwareBypass": false
    }
  },
  "privacy": {
    "locationServices": "enabled",
    "telemetryTracing": "disabled",
    "advertisingId": "disabled",
    "activityHistory": "disabled"
  },
  "diagnostics": {
    "retainFirstLogonArtifacts": true
  }
}
